Title,Published At,URL,Sentiment,Sentiment Score
Absolute Flash #1 Tops The Bleeding Cool Weekly Bestseller List,2025-03-22T15:57:13Z,https://bleedingcool.com/comics/absolute-flash-1-tops-the-bleeding-cool-weekly-bestseller-list/,Positive,0.6808
Is The Correction Over?,2025-03-22T09:49:22Z,https://realinvestmentadvice.com/resources/blog/is-the-correction-over/,Neutral,0.0
JPMorgan renamed its DEI programs amid pressure from Washington. Read the full memo.,2025-03-21T15:32:07Z,https://www.businessinsider.com/jpmorgan-renames-dei-programs-diversity-hiring-trump-memo-piepszak-2025-3,Negative,-0.296
Global Oil Demand Makes Strong Start to 2025,2025-03-21T12:59:12Z,https://www.rigzone.com/news/global_oil_demand_makes_strong_start_to_2025-21-mar-2025-179997-article/,Positive,0.4215
Fidelity Investments Sweeps 10th Annual IBD List Of Best Mutual Funds,2025-03-21T12:25:03Z,https://www.investors.com/etfs-and-funds/mutual-funds/fidelity-investments-sweeps-2025-best-mutual-funds/,Positive,0.6369
Truvestments Capital LLC Has $1.16 Million Holdings in JPMorgan Chase & Co. (NYSE:JPM),2025-03-21T11:15:53Z,https://www.etfdailynews.com/2025/03/21/truvestments-capital-llc-has-1-16-million-holdings-in-jpmorgan-chase-co-nysejpm/,Neutral,0.0
Knuff & Co LLC Acquires 113 Shares of JPMorgan Chase & Co. (NYSE:JPM),2025-03-21T11:15:47Z,https://www.etfdailynews.com/2025/03/21/knuff-co-llc-acquires-113-shares-of-jpmorgan-chase-co-nysejpm/,Positive,0.296
Avantax Advisory Services Inc. Has $76.94 Million Holdings in JPMorgan Chase & Co. (NYSE:JPM),2025-03-21T11:15:46Z,https://www.etfdailynews.com/2025/03/21/avantax-advisory-services-inc-has-76-94-million-holdings-in-jpmorgan-chase-co-nysejpm/,Neutral,0.0
JPMorgan Chase & Co. (NYSE:JPM) Stock Holdings Trimmed by Westchester Capital Management Inc.,2025-03-21T11:15:45Z,https://www.etfdailynews.com/2025/03/21/jpmorgan-chase-co-nysejpm-stock-holdings-trimmed-by-westchester-capital-management-inc/,Neutral,0.0
"10,614 Shares in JPMorgan Chase & Co. (NYSE:JPM) Bought by SHEPHERD WEALTH MANAGEMENT Ltd LIABILITY Co",2025-03-21T11:15:45Z,https://www.etfdailynews.com/2025/03/21/10614-shares-in-jpmorgan-chase-co-nysejpm-bought-by-shepherd-wealth-management-ltd-liability-co/,Positive,0.5574
Securian Asset Management Inc. Has $36.27 Million Stock Position in JPMorgan Chase & Co. (NYSE:JPM),2025-03-21T11:15:43Z,https://www.etfdailynews.com/2025/03/21/securian-asset-management-inc-has-36-27-million-stock-position-in-jpmorgan-chase-co-nysejpm/,Positive,0.3612
Liberty Wealth Management LLC Increases Position in JPMorgan Chase & Co. (NYSE:JPM),2025-03-21T11:15:43Z,https://www.etfdailynews.com/2025/03/21/liberty-wealth-management-llc-increases-position-in-jpmorgan-chase-co-nysejpm/,Positive,0.765
Hopwood Financial Services Inc. Purchases New Position in JPMorgan Chase & Co. (NYSE:JPM),2025-03-21T11:15:42Z,https://www.etfdailynews.com/2025/03/21/hopwood-financial-services-inc-purchases-new-position-in-jpmorgan-chase-co-nysejpm/,Neutral,0.0
Essential Planning LLC. Increases Position in JPMorgan Chase & Co. (NYSE:JPM),2025-03-21T11:15:38Z,https://www.etfdailynews.com/2025/03/21/essential-planning-llc-increases-position-in-jpmorgan-chase-co-nysejpm/,Neutral,0.0
Rakuten Securities Inc. Grows Stock Holdings in JPMorgan Chase & Co. (NYSE:JPM),2025-03-21T11:15:37Z,https://www.etfdailynews.com/2025/03/21/rakuten-securities-inc-grows-stock-holdings-in-jpmorgan-chase-co-nysejpm/,Positive,0.296
Smart Portfolios LLC Trims Stock Holdings in JPMorgan Chase & Co. (NYSE:JPM),2025-03-21T11:15:37Z,https://www.etfdailynews.com/2025/03/21/smart-portfolios-llc-trims-stock-holdings-in-jpmorgan-chase-co-nysejpm/,Positive,0.4019
JPMorgan Chase & Co. (NYSE:JPM) Stake Lifted by Connor Clark & Lunn Investment Management Ltd.,2025-03-21T11:15:37Z,https://www.etfdailynews.com/2025/03/21/jpmorgan-chase-co-nysejpm-stake-lifted-by-connor-clark-lunn-investment-management-ltd/,Neutral,0.0
EverSource Wealth Advisors LLC Buys 890 Shares of JPMorgan Chase & Co. (NYSE:JPM),2025-03-21T08:59:00Z,https://www.etfdailynews.com/2025/03/21/eversource-wealth-advisors-llc-buys-890-shares-of-jpmorgan-chase-co-nysejpm/,Positive,0.6597
JPMorgan Chase & Co. (NYSE:JPM) Shares Sold by Hollencrest Capital Management,2025-03-21T08:58:59Z,https://www.etfdailynews.com/2025/03/21/jpmorgan-chase-co-nysejpm-shares-sold-by-hollencrest-capital-management/,Positive,0.296
"Saturna Capital Corp Has $552,000 Stock Holdings in JPMorgan Chase & Co. (NYSE:JPM)",2025-03-21T08:58:56Z,https://www.etfdailynews.com/2025/03/21/saturna-capital-corp-has-552000-stock-holdings-in-jpmorgan-chase-co-nysejpm/,Neutral,0.0
Farther Finance Advisors LLC Has $9.83 Million Stake in JPMorgan Chase & Co. (NYSE:JPM),2025-03-21T08:58:53Z,https://www.etfdailynews.com/2025/03/21/farther-finance-advisors-llc-has-9-83-million-stake-in-jpmorgan-chase-co-nysejpm/,Neutral,0.0
Bender Robert & Associates Cuts Stake in JPMorgan Chase & Co. (NYSE:JPM),2025-03-21T08:21:08Z,https://www.etfdailynews.com/2025/03/21/bender-robert-associates-cuts-stake-in-jpmorgan-chase-co-nysejpm/,Negative,-0.296
"PFG Advisors Sells 1,156 Shares of JPMorgan Chase & Co. (NYSE:JPM)",2025-03-21T07:42:53Z,https://www.etfdailynews.com/2025/03/21/pfg-advisors-sells-1156-shares-of-jpmorgan-chase-co-nysejpm/,Positive,0.296
JPMorgan Chase & Co. (JPM): A Bull Case Theory,2025-03-20T22:36:11Z,https://consent.yahoo.com/v2/collectConsent?sessionId=1_cc-session_2930f4d7-7cbf-42ad-b7f6-71a21a3b2d08,Neutral,0.0
"Elon Musk needs to do these two things to get Tesla back on track, analyst says",2025-03-20T13:34:00Z,https://qz.com/elon-musk-tesla-doge-brand-damage-trump-analyst-stock-1851771204,Neutral,0.0
Wall Street is starting to trim jobs as economic uncertainties mount,2025-03-20T12:44:29Z,https://finance.yahoo.com/news/wall-street-is-starting-to-trim-jobs-as-economic-uncertainties-mount-124429335.html,Negative,-0.34
Sage Mountain Advisors LLC Raises Stake in JPMorgan Chase & Co. (NYSE:JPM),2025-03-20T10:29:04Z,https://www.etfdailynews.com/2025/03/20/sage-mountain-advisors-llc-raises-stake-in-jpmorgan-chase-co-nysejpm/,Neutral,0.0
Prosperity Financial Group Inc. Acquires 66 Shares of JPMorgan Chase & Co. (NYSE:JPM),2025-03-20T10:29:03Z,https://www.etfdailynews.com/2025/03/20/prosperity-financial-group-inc-acquires-66-shares-of-jpmorgan-chase-co-nysejpm/,Positive,0.296
O Dell Group LLC Has $4.42 Million Stake in JPMorgan Chase & Co. (NYSE:JPM),2025-03-20T10:29:03Z,https://www.etfdailynews.com/2025/03/20/o-dell-group-llc-has-4-42-million-stake-in-jpmorgan-chase-co-nysejpm/,Neutral,0.0
JPMorgan Chase & Co. (NYSE:JPM) Stake Lifted by Prosperity Wealth Management Inc.,2025-03-20T10:29:03Z,https://www.etfdailynews.com/2025/03/20/jpmorgan-chase-co-nysejpm-stake-lifted-by-prosperity-wealth-management-inc/,Positive,0.4939
Pzena Investment Management LLC Trims Stock Holdings in JPMorgan Chase & Co. (NYSE:JPM),2025-03-20T10:29:01Z,https://www.etfdailynews.com/2025/03/20/pzena-investment-management-llc-trims-stock-holdings-in-jpmorgan-chase-co-nysejpm/,Neutral,0.0
Briaud Financial Planning Inc Buys 505 Shares of JPMorgan Chase & Co. (NYSE:JPM),2025-03-20T10:29:01Z,https://www.etfdailynews.com/2025/03/20/briaud-financial-planning-inc-buys-505-shares-of-jpmorgan-chase-co-nysejpm/,Positive,0.296
JPMorgan Chase & Co. (NYSE:JPM) Holdings Trimmed by Staley Capital Advisers Inc.,2025-03-20T10:29:01Z,https://www.etfdailynews.com/2025/03/20/jpmorgan-chase-co-nysejpm-holdings-trimmed-by-staley-capital-advisers-inc/,Neutral,0.0
AGF Management Ltd. Increases Stake in JPMorgan Chase & Co. (NYSE:JPM),2025-03-20T09:57:08Z,https://www.etfdailynews.com/2025/03/20/agf-management-ltd-increases-stake-in-jpmorgan-chase-co-nysejpm/,Neutral,0.0
JPMorgan Chase & Co. (NYSE:JPM) is Gables Capital Management Inc.’s 8th Largest Position,2025-03-20T09:57:03Z,https://www.etfdailynews.com/2025/03/20/jpmorgan-chase-co-nysejpm-is-gables-capital-management-inc-s-8th-largest-position/,Neutral,0.0
Founders Financial Alliance LLC Grows Stock Holdings in JPMorgan Chase & Co. (NYSE:JPM),2025-03-20T09:57:03Z,https://www.etfdailynews.com/2025/03/20/founders-financial-alliance-llc-grows-stock-holdings-in-jpmorgan-chase-co-nysejpm/,Neutral,0.0
Inspire Advisors LLC Increases Stake in JPMorgan Chase & Co. (NYSE:JPM),2025-03-20T09:57:03Z,https://www.etfdailynews.com/2025/03/20/inspire-advisors-llc-increases-stake-in-jpmorgan-chase-co-nysejpm/,Positive,0.5719
Cushing Capital Partners LLC Buys New Stake in JPMorgan Chase & Co. (NYSE:JPM),2025-03-20T09:57:00Z,https://www.etfdailynews.com/2025/03/20/cushing-capital-partners-llc-buys-new-stake-in-jpmorgan-chase-co-nysejpm/,Neutral,0.0
Avantax Planning Partners Inc. Has $12.77 Million Holdings in JPMorgan Chase & Co. (NYSE:JPM),2025-03-20T09:56:52Z,https://www.etfdailynews.com/2025/03/20/avantax-planning-partners-inc-has-12-77-million-holdings-in-jpmorgan-chase-co-nysejpm/,Neutral,0.0
"Claris Advisors LLC MO Buys 1,400 Shares of JPMorgan Chase & Co. (NYSE:JPM)",2025-03-20T08:34:54Z,https://www.etfdailynews.com/2025/03/20/claris-advisors-llc-mo-buys-1400-shares-of-jpmorgan-chase-co-nysejpm/,Positive,0.296
JPMorgan Chase & Co. (NYSE:JPM) Shares Sold by King Luther Capital Management Corp,2025-03-20T08:34:54Z,https://www.etfdailynews.com/2025/03/20/jpmorgan-chase-co-nysejpm-shares-sold-by-king-luther-capital-management-corp/,Positive,0.296
Cooke & Bieler LP Has $54.94 Million Stock Holdings in JPMorgan Chase & Co. (NYSE:JPM),2025-03-20T08:34:54Z,https://www.etfdailynews.com/2025/03/20/cooke-bieler-lp-has-54-94-million-stock-holdings-in-jpmorgan-chase-co-nysejpm/,Neutral,0.0
Dearborn Partners LLC Sells 50 Shares of JPMorgan Chase & Co. (NYSE:JPM),2025-03-20T08:34:54Z,https://www.etfdailynews.com/2025/03/20/dearborn-partners-llc-sells-50-shares-of-jpmorgan-chase-co-nysejpm/,Positive,0.296
Davis R M Inc. Boosts Position in JPMorgan Chase & Co. (NYSE:JPM),2025-03-20T08:34:53Z,https://www.etfdailynews.com/2025/03/20/davis-r-m-inc-boosts-position-in-jpmorgan-chase-co-nysejpm/,Positive,0.3182
"8,649 Shares in JPMorgan Chase & Co. (NYSE:JPM) Acquired by Vista Investment Partners II LLC",2025-03-20T08:34:53Z,https://www.etfdailynews.com/2025/03/20/8649-shares-in-jpmorgan-chase-co-nysejpm-acquired-by-vista-investment-partners-ii-llc/,Positive,0.296
JPMorgan Chase & Co. (NYSE:JPM) Stock Position Cut by Morton Community Bank,2025-03-20T08:34:53Z,https://www.etfdailynews.com/2025/03/20/jpmorgan-chase-co-nysejpm-stock-position-cut-by-morton-community-bank/,Negative,-0.2732
"Mcdonald Capital Investors Inc. CA Sells 3,405 Shares of JPMorgan Chase & Co. (NYSE:JPM)",2025-03-20T08:34:53Z,https://www.etfdailynews.com/2025/03/20/mcdonald-capital-investors-inc-ca-sells-3405-shares-of-jpmorgan-chase-co-nysejpm/,Positive,0.296
Is JPMorgan Chase (JPM) Among The Best Bank Stocks To Buy According To Billionaires?,2025-03-19T19:07:26Z,https://consent.yahoo.com/v2/collectConsent?sessionId=1_cc-session_fad5b213-0dd3-4356-a407-b93cb102a1e5,Positive,0.6369
JP Morgan Is Taking Big Risks With AI - And Businesses Everywhere Should Be Thankful,2025-03-19T17:00:17Z,https://www.forbes.com/sites/quickerbettertech/2025/03/19/jp-morgan-is-taking-big-risks-with-aiand-businesses-everywhere-should-be-thankful/,Positive,0.6289
Trump is trying to save Tesla from the anti-Elon Musk crowd,2025-03-19T14:33:48Z,https://qz.com/trump-save-tesla-elon-musk-protests-violent-bondi-1851770938,Positive,0.4939
Altiora Financial Group LLC Makes New Investment in JPMorgan Chase & Co. (NYSE:JPM),2025-03-19T09:36:56Z,https://www.etfdailynews.com/2025/03/19/altiora-financial-group-llc-makes-new-investment-in-jpmorgan-chase-co-nysejpm/,Neutral,0.0
Independent Advisor Alliance Raises Stock Position in JPMorgan Chase & Co. (NYSE:JPM),2025-03-19T09:36:55Z,https://www.etfdailynews.com/2025/03/19/independent-advisor-alliance-raises-stock-position-in-jpmorgan-chase-co-nysejpm/,Neutral,0.0
Paragon Private Wealth Management LLC Acquires 868 Shares of JPMorgan Chase & Co. (NYSE:JPM),2025-03-19T09:36:52Z,https://www.etfdailynews.com/2025/03/19/paragon-private-wealth-management-llc-acquires-868-shares-of-jpmorgan-chase-co-nysejpm/,Positive,0.6597
JPMorgan Chase & Co. (NYSE:JPM) Holdings Trimmed by Keb Asset Management LLC,2025-03-19T08:59:03Z,https://www.etfdailynews.com/2025/03/19/jpmorgan-chase-co-nysejpm-holdings-trimmed-by-keb-asset-management-llc/,Positive,0.3612
Voisard Asset Management Group Inc. Reduces Stake in JPMorgan Chase & Co. (NYSE:JPM),2025-03-19T08:59:02Z,https://www.etfdailynews.com/2025/03/19/voisard-asset-management-group-inc-reduces-stake-in-jpmorgan-chase-co-nysejpm/,Positive,0.3612
JPMorgan Chase & Co. (NYSE:JPM) Shares Sold by Midland Wealth Advisors LLC,2025-03-19T08:59:02Z,https://www.etfdailynews.com/2025/03/19/jpmorgan-chase-co-nysejpm-shares-sold-by-midland-wealth-advisors-llc/,Positive,0.6597
Tassel Capital Management Inc. Takes Position in JPMorgan Chase & Co. (NYSE:JPM),2025-03-19T08:59:02Z,https://www.etfdailynews.com/2025/03/19/tassel-capital-management-inc-takes-position-in-jpmorgan-chase-co-nysejpm/,Neutral,0.0
"Gallagher Capital Advisors LLC Buys Shares of 12,281 JPMorgan Chase & Co. (NYSE:JPM)",2025-03-19T08:59:02Z,https://www.etfdailynews.com/2025/03/19/gallagher-capital-advisors-llc-buys-shares-of-12281-jpmorgan-chase-co-nysejpm/,Positive,0.296
JPMorgan Chase & Co. (NYSE:JPM) Shares Acquired by FWG Holdings LLC,2025-03-19T08:59:02Z,https://www.etfdailynews.com/2025/03/19/jpmorgan-chase-co-nysejpm-shares-acquired-by-fwg-holdings-llc/,Positive,0.296
"Main Street Research LLC Acquires 4,168 Shares of JPMorgan Chase & Co. (NYSE:JPM)",2025-03-19T08:59:01Z,https://www.etfdailynews.com/2025/03/19/main-street-research-llc-acquires-4168-shares-of-jpmorgan-chase-co-nysejpm/,Positive,0.296
Moran Wealth Management LLC Sells 417 Shares of JPMorgan Chase & Co. (NYSE:JPM),2025-03-19T08:59:01Z,https://www.etfdailynews.com/2025/03/19/moran-wealth-management-llc-sells-417-shares-of-jpmorgan-chase-co-nysejpm/,Positive,0.6597
"SLT Holdings LLC Takes $200,000 Position in JPMorgan Chase & Co. (NYSE:JPM)",2025-03-19T08:20:58Z,https://www.etfdailynews.com/2025/03/19/slt-holdings-llc-takes-200000-position-in-jpmorgan-chase-co-nysejpm/,Neutral,0.0
NBT Bank N A NY Has $33.72 Million Holdings in JPMorgan Chase & Co. (NYSE:JPM),2025-03-19T08:20:57Z,https://www.etfdailynews.com/2025/03/19/nbt-bank-n-a-ny-has-33-72-million-holdings-in-jpmorgan-chase-co-nysejpm/,Neutral,0.0
JPMorgan Chase & Co. (NYSE:JPM) Shares Purchased by Bell Investment Advisors Inc,2025-03-19T08:20:56Z,https://www.etfdailynews.com/2025/03/19/jpmorgan-chase-co-nysejpm-shares-purchased-by-bell-investment-advisors-inc/,Positive,0.296
JPMorgan Chase & Co. (NYSE:JPM) Shares Acquired by Solitude Financial Services,2025-03-19T08:20:56Z,https://www.etfdailynews.com/2025/03/19/jpmorgan-chase-co-nysejpm-shares-acquired-by-solitude-financial-services/,Positive,0.296
Mount Lucas Management LP Has $3.34 Million Stock Holdings in JPMorgan Chase & Co. (NYSE:JPM),2025-03-19T08:20:55Z,https://www.etfdailynews.com/2025/03/19/mount-lucas-management-lp-has-3-34-million-stock-holdings-in-jpmorgan-chase-co-nysejpm/,Neutral,0.0
Zurcher Kantonalbank Zurich Cantonalbank Raises Position in JPMorgan Chase & Co. (NYSE:JPM),2025-03-19T08:20:54Z,https://www.etfdailynews.com/2025/03/19/zurcher-kantonalbank-zurich-cantonalbank-raises-position-in-jpmorgan-chase-co-nysejpm/,Neutral,0.0
"Simplicity Wealth LLC Sells 14,004 Shares of JPMorgan Chase & Co. (NYSE:JPM)",2025-03-19T08:20:54Z,https://www.etfdailynews.com/2025/03/19/simplicity-wealth-llc-sells-14004-shares-of-jpmorgan-chase-co-nysejpm/,Positive,0.6597
Leaked memo: Inside JPMorgan's RTO plan for its largest office,2025-03-18T16:36:32Z,https://www.businessinsider.com/jpmorgan-rto-leaked-memo-polaris-employees-columbus-parking-dining-2025-3,Negative,-0.3182
Energy Fantasy Versus Reality In Woke-Land — Part III,2025-03-18T13:00:00Z,https://wattsupwiththat.com/2025/03/18/energy-fantasy-versus-reality-in-woke-land-part-iii/,Positive,0.2732
Energy Fantasy Versus Reality In Woke-Land -- Part III,2025-03-18T12:52:14Z,https://freerepublic.com/focus/f-chat/4305049/posts,Positive,0.2732
USA EIA Boosts Henry Hub Natural Gas Price Forecasts,2025-03-18T12:20:44Z,https://www.rigzone.com/news/usa_eia_boosts_henry_hub_natural_gas_price_forecasts-18-mar-2025-179955-article/,Positive,0.5859
JPMorgan Chase & Co. (NYSE:JPM) Shares Sold by Oak Harbor Wealth Partners LLC,2025-03-18T10:53:05Z,https://www.etfdailynews.com/2025/03/18/jpmorgan-chase-co-nysejpm-shares-sold-by-oak-harbor-wealth-partners-llc/,Positive,0.6597
Garrison Bradford & Associates Inc. Purchases New Shares in JPMorgan Chase & Co. (NYSE:JPM),2025-03-18T10:53:04Z,https://www.etfdailynews.com/2025/03/18/garrison-bradford-associates-inc-purchases-new-shares-in-jpmorgan-chase-co-nysejpm/,Positive,0.296
M. Kulyk & Associates LLC Acquires New Position in JPMorgan Chase & Co. (NYSE:JPM),2025-03-18T10:53:04Z,https://www.etfdailynews.com/2025/03/18/m-kulyk-associates-llc-acquires-new-position-in-jpmorgan-chase-co-nysejpm/,Neutral,0.0
"Blake Schutter Theil Wealth Advisors LLC Sells 6,652 Shares of JPMorgan Chase & Co. (NYSE:JPM)",2025-03-18T10:53:04Z,https://www.etfdailynews.com/2025/03/18/blake-schutter-theil-wealth-advisors-llc-sells-6652-shares-of-jpmorgan-chase-co-nysejpm/,Positive,0.6597
"Argentarii LLC Purchases Shares of 25,635 JPMorgan Chase & Co. (NYSE:JPM)",2025-03-18T10:53:03Z,https://www.etfdailynews.com/2025/03/18/argentarii-llc-purchases-shares-of-25635-jpmorgan-chase-co-nysejpm/,Positive,0.296
"Axis Wealth Partners LLC Purchases Shares of 2,228 JPMorgan Chase & Co. (NYSE:JPM)",2025-03-18T10:53:03Z,https://www.etfdailynews.com/2025/03/18/axis-wealth-partners-llc-purchases-shares-of-2228-jpmorgan-chase-co-nysejpm/,Positive,0.6597
Barings LLC Sells 238 Shares of JPMorgan Chase & Co. (NYSE:JPM),2025-03-18T10:53:03Z,https://www.etfdailynews.com/2025/03/18/barings-llc-sells-238-shares-of-jpmorgan-chase-co-nysejpm/,Positive,0.296
JPMorgan Chase & Co. (NYSE:JPM) Holdings Trimmed by Farrow Financial Inc.,2025-03-18T10:53:02Z,https://www.etfdailynews.com/2025/03/18/jpmorgan-chase-co-nysejpm-holdings-trimmed-by-farrow-financial-inc/,Neutral,0.0
Horan Securities Inc. Sells 128 Shares of JPMorgan Chase & Co. (NYSE:JPM),2025-03-18T10:53:02Z,https://www.etfdailynews.com/2025/03/18/horan-securities-inc-sells-128-shares-of-jpmorgan-chase-co-nysejpm/,Positive,0.5267
OFI Invest Asset Management Invests $85.69 Million in JPMorgan Chase & Co. (NYSE:JPM),2025-03-18T10:53:02Z,https://www.etfdailynews.com/2025/03/18/ofi-invest-asset-management-invests-85-69-million-in-jpmorgan-chase-co-nysejpm/,Positive,0.3612
Amundi Cuts Holdings in JPMorgan Chase & Co. (NYSE:JPM),2025-03-18T08:48:53Z,https://www.etfdailynews.com/2025/03/18/amundi-cuts-holdings-in-jpmorgan-chase-co-nysejpm/,Negative,-0.296
Marble Harbor Investment Counsel LLC Sells 72 Shares of JPMorgan Chase & Co. (NYSE:JPM),2025-03-18T08:48:53Z,https://www.etfdailynews.com/2025/03/18/marble-harbor-investment-counsel-llc-sells-72-shares-of-jpmorgan-chase-co-nysejpm/,Positive,0.296
Larson Financial Group LLC Boosts Stake in JPMorgan Chase & Co. (NYSE:JPM),2025-03-18T08:48:53Z,https://www.etfdailynews.com/2025/03/18/larson-financial-group-llc-boosts-stake-in-jpmorgan-chase-co-nysejpm/,Positive,0.3182
"Rialto Wealth Management LLC Invests $448,000 in JPMorgan Chase & Co. (NYSE:JPM)",2025-03-18T08:48:52Z,https://www.etfdailynews.com/2025/03/18/rialto-wealth-management-llc-invests-448000-in-jpmorgan-chase-co-nysejpm/,Positive,0.4939
Hamilton Capital Partners LLC Makes New Investment in JPMorgan Chase & Co. (NYSE:JPM),2025-03-18T08:48:52Z,https://www.etfdailynews.com/2025/03/18/hamilton-capital-partners-llc-makes-new-investment-in-jpmorgan-chase-co-nysejpm/,Neutral,0.0
BOK Financial Private Wealth Inc. Reduces Stake in JPMorgan Chase & Co. (NYSE:JPM),2025-03-18T08:09:04Z,https://www.etfdailynews.com/2025/03/18/bok-financial-private-wealth-inc-reduces-stake-in-jpmorgan-chase-co-nysejpm/,Positive,0.4939
Pettee Investors Inc. Sells 44 Shares of JPMorgan Chase & Co. (NYSE:JPM),2025-03-18T08:09:01Z,https://www.etfdailynews.com/2025/03/18/pettee-investors-inc-sells-44-shares-of-jpmorgan-chase-co-nysejpm/,Positive,0.296
"Sound View Wealth Advisors Group LLC Sells 1,111 Shares of JPMorgan Chase & Co. (NYSE:JPM)",2025-03-18T08:08:59Z,https://www.etfdailynews.com/2025/03/18/sound-view-wealth-advisors-group-llc-sells-1111-shares-of-jpmorgan-chase-co-nysejpm/,Positive,0.6597
JPMorgan Chase & Co. (NYSE:JPM) Position Raised by Enterprise Financial Services Corp,2025-03-18T08:08:57Z,https://www.etfdailynews.com/2025/03/18/jpmorgan-chase-co-nysejpm-position-raised-by-enterprise-financial-services-corp/,Neutral,0.0
"3,151 Shares in JPMorgan Chase & Co. (NYSE:JPM) Bought by Permanent Capital Management LP",2025-03-18T07:37:01Z,https://www.etfdailynews.com/2025/03/18/3151-shares-in-jpmorgan-chase-co-nysejpm-bought-by-permanent-capital-management-lp/,Positive,0.296
JPMorgan Chase & Co. (NYSE:JPM) is Dorsey & Whitney Trust CO LLC’s 10th Largest Position,2025-03-18T07:37:01Z,https://www.etfdailynews.com/2025/03/18/jpmorgan-chase-co-nysejpm-is-dorsey-whitney-trust-co-llcs-10th-largest-position/,Positive,0.5106
Best Financial Stocks To Consider – March 16th,2025-03-18T06:07:03Z,https://www.etfdailynews.com/2025/03/18/best-financial-stocks-to-consider-march-16th/,Positive,0.6369
Top Bank Stocks To Follow Today – March 16th,2025-03-18T06:07:01Z,https://www.etfdailynews.com/2025/03/18/top-bank-stocks-to-follow-today-march-16th/,Positive,0.2023
JPM Carbon Transition US Equity ETF (NYSEARCA:JCTR) Stock Price Up 0.8% – Here’s Why,2025-03-18T05:46:49Z,https://www.etfdailynews.com/2025/03/18/jpm-carbon-transition-us-equity-etf-nysearcajctr-stock-price-up-0-8-heres-why/,Neutral,0.0
What it costs to buy a house in the 15 fastest-growing states in America,2025-03-17T16:12:00Z,https://qz.com/homes-housing-costs-us-states-1851769760,Neutral,0.0
North America Cuts 35 Rigs Week on Week,2025-03-17T15:55:34Z,https://www.rigzone.com/news/north_america_cuts_35_rigs_week_on_week-17-mar-2025-179946-article/,Negative,-0.296
Is a recession coming? Here's what Trump and his people are saying,2025-03-17T15:27:00Z,https://qz.com/recession-trump-officials-allies-respond-trade-tariffs-1851770349,Negative,-0.4215
Bitcoin Network Hashrate Inched Higher in March as Mining Economics Weakened: JPMorgan,2025-03-17T14:19:38Z,https://www.coindesk.com/markets/2025/03/17/bitcoin-network-hashrate-inched-higher-in-march-as-mining-economics-weakened-jpmorgan,Negative,-0.3182
