Title,Published At,URL,Sentiment,Sentiment Score
Is Qualcomm Inc (QCOM) the Top Growth Stock in David Tepper’s Portfolio?,2025-03-29T23:21:52Z,https://finance.yahoo.com/news/qualcomm-inc-qcom-top-growth-232152973.html,Positive,0.5267
"Is Waste Management, Inc. (WM) the Best Waste Management Stock to Invest In Now?",2025-03-29T22:47:29Z,https://finance.yahoo.com/news/waste-management-inc-wm-best-224729116.html,Negative,-0.1027
Kevin Fenzi: Late March infra bits 2025,2025-03-29T20:04:01Z,https://www.scrye.com/blogs/nirik/posts/2025/03/29/late-march-infra-bits-2025/,Neutral,0.0
Tech companies develop a keen AI for niche talent,2025-03-29T18:20:12Z,https://economictimes.indiatimes.com/jobs/hr-policies-trends/tech-companies-develop-a-keen-ai-for-niche-talent/articleshow/119722197.cms,Positive,0.6486
FBI and DOJ seize $8.2 Million in romance baiting crypto fraud scheme,2025-03-29T17:58:37Z,https://securityaffairs.com/175990/cyber-crime/fbi-and-doj-seize-8-2-million-in-romance-baiting-crypto-fraud-scheme.html,Negative,-0.0516
Experts warn of the new sophisticate Crocodilus mobile banking Trojan,2025-03-29T16:41:36Z,https://securityaffairs.com/175976/malware/new-sophisticate-crocodilus-mobile-banking-trojan.html,Negative,-0.1027
"Digital Fault Recorder Market to Reach USD 3.4 Billion by 2032, at a CAGR of 8.84% | Research by SNS Insider",2025-03-29T13:30:00Z,https://www.globenewswire.com/news-release/2025/03/29/3051735/0/en/Digital-Fault-Recorder-Market-to-Reach-USD-3-4-Billion-by-2032-at-a-CAGR-of-8-84-Research-by-SNS-Insider.html,Negative,-0.3818
"Smoke Detector Market to Exceed USD 4.32 Billion by 2032, Driven by Stringent Fire Safety Regulations and Increasing Adoption in Residential and Commercial Buildings | SNS Insider",2025-03-29T13:00:00Z,https://www.globenewswire.com/news-release/2025/03/29/3051732/0/en/Smoke-Detector-Market-to-Exceed-USD-4-32-Billion-by-2032-Driven-by-Stringent-Fire-Safety-Regulations-and-Increasing-Adoption-in-Residential-and-Commercial-Buildings-SNS-Insider.html,Positive,0.1027
"Xponance Inc. Makes New Investment in Telephone and Data Systems, Inc. (NYSE:TDS)",2025-03-29T08:57:09Z,https://www.etfdailynews.com/2025/03/29/xponance-inc-makes-new-investment-in-telephone-and-data-systems-inc-nysetds/,Neutral,0.0
全国の建築のプロに提案できる日本最大級の建築に関する展示会「第47回 Japan Home Show & Building Show 2025」開催,2025-03-29T08:40:02Z,https://prtimes.jp/main/html/rd/p/000000153.000016501.html,Neutral,0.0
"Smith Micro Software, Inc. (NASDAQ:SMSI) Short Interest Down 42.3% in March",2025-03-29T08:08:59Z,https://www.etfdailynews.com/2025/03/29/smith-micro-software-inc-nasdaqsmsi-short-interest-down-42-3-in-march/,Positive,0.4588
"Envestnet Portfolio Solutions Inc. Buys New Shares in Zscaler, Inc. (NASDAQ:ZS)",2025-03-29T08:06:44Z,https://www.etfdailynews.com/2025/03/29/envestnet-portfolio-solutions-inc-buys-new-shares-in-zscaler-inc-nasdaqzs/,Positive,0.4404
Energys Group Ltd. Prices IPO at $4.50-$6.50 Per Share (ENGS),2025-03-29T07:04:42Z,https://www.etfdailynews.com/2025/03/29/energys-group-ltd-prices-ipo-at-4-50-6-50-per-share-engs/,Positive,0.296
Energys Group Ltd. Plans $13 Million IPO for April 2nd (ENGS),2025-03-29T06:28:57Z,https://www.etfdailynews.com/2025/03/29/energys-group-ltd-plans-13-million-ipo-for-april-2nd-engs-2/,Neutral,0.0
"LogicMark, Inc. (NASDAQ:LGMK) Short Interest Update",2025-03-29T06:27:07Z,https://www.etfdailynews.com/2025/03/29/logicmark-inc-nasdaqlgmk-short-interest-update/,Positive,0.4588
Analysts Issue Forecasts for ASNS Q1 Earnings,2025-03-29T06:23:08Z,https://www.etfdailynews.com/2025/03/29/analysts-issue-forecasts-for-asns-q1-earnings/,Neutral,0.0
Check Point Software Technologies (NASDAQ:CHKP) Downgraded by StockNews.com to “Hold”,2025-03-29T06:10:52Z,https://www.etfdailynews.com/2025/03/29/check-point-software-technologies-nasdaqchkp-downgraded-by-stocknews-com-to-hold/,Neutral,0.0
Bank of America Upgrades Check Point Software Technologies (NASDAQ:CHKP) to Buy,2025-03-29T05:38:43Z,https://www.etfdailynews.com/2025/03/29/bank-of-america-upgrades-check-point-software-technologies-nasdaqchkp-to-buy/,Neutral,0.0
Contrasting Veradigm (NASDAQ:MDRX) and Veea (NASDAQ:VEEA),2025-03-29T05:36:48Z,https://www.etfdailynews.com/2025/03/29/contrasting-veradigm-nasdaqmdrx-and-veea-nasdaqveea/,Neutral,0.0
Silicon Laboratories (NASDAQ:SLAB) Lowered to “Sell” Rating by StockNews.com,2025-03-29T05:24:44Z,https://www.etfdailynews.com/2025/03/29/silicon-laboratories-nasdaqslab-lowered-to-sell-rating-by-stocknews-com/,Negative,-0.128
Eclipse Temurin 2025.04 Progress,2025-03-29T04:09:13Z,https://projects.eclipse.org/projects/adoptium.temurin/reviews/2025.04-progress-review,Positive,0.4215
"Cabinet greenlights Rs 23,000 crore e-parts production scheme",2025-03-29T02:55:16Z,https://economictimes.indiatimes.com/tech/technology/cabinet-greenlights-rs-23000-crore-e-parts-production-scheme/articleshow/119686327.cms,Neutral,0.0
SECURING THE DIGITAL WORLD,2025-03-28T23:00:00Z,https://www.thestar.com.my/news/nation/2025/03/29/securing-the-digital-world,Positive,0.3182
Training an AI Model? Wait… What Does That Actually Mean?,2025-03-28T21:53:39Z,https://martech.zone/what-is-training-an-ai-model/,Neutral,0.0
Crooks are reviving the Grandoreiro banking trojan,2025-03-28T21:14:09Z,https://securityaffairs.com/175964/malware/crooks-are-reviving-the-grandoreiro-banking-trojan.html,Neutral,0.0
"Unlocking The Power Of Data At The Edge With Dell NativeEdge, Dell Data Lakehouse And Dell AI Factory",2025-03-28T20:56:39Z,https://www.forbes.com/sites/delltechnologies/2025/03/28/unlocking-the-power-of-data-at-the-edge-with-dell-nativeedge-dell-data-lakehouse-and-dell-ai-factory/,Neutral,0.0
"Amazon Bedrock Guardrails image content filters provide industry-leading safeguards, helping customer block up to 88% of harmful multimodal content: Generally available today",2025-03-28T20:01:07Z,https://aws.amazon.com/blogs/machine-learning/amazon-bedrock-guardrails-image-content-filters-provide-industry-leading-safeguards-helping-customer-block-up-to-88-of-harmful-multimodal-content-generally-available-today/,Positive,0.34
"How ExtremeCloud Edge improves cloud management with secure, scalable networking",2025-03-28T19:42:29Z,https://siliconangle.com/2025/03/28/extremecloud-edge-cloud-management-ai-security-scalability-networking-innovation-cubedawards25/,Positive,0.6369
Russian authorities arrest three suspects behind Mamont Android banking trojan,2025-03-28T18:47:37Z,https://securityaffairs.com/175935/cyber-crime/russian-authorities-arrest-three-suspects-behind-mamont-android-banking-trojan.html,Negative,-0.5859
News brief: China-linked APTs and Russian access broker,2025-03-28T18:07:00Z,https://www.techtarget.com/searchsecurity/news/366621697/News-brief-China-linked-APTs-and-Russian-access-broker,Neutral,0.0
CQS315 & CQS325: Setting New Standards for Smart Connected Solutions with Edge Computing,2025-03-28T17:46:34Z,https://financialpost.com/globe-newswire/cqs315-cqs325-setting-new-standards-for-smart-connected-solutions-with-edge-computing,Positive,0.5267
CQS315 & CQS325: Setting New Standards for Smart Connected Solutions with Edge Computing,2025-03-28T17:42:00Z,https://www.globenewswire.com/news-release/2025/03/28/3051572/0/en/CQS315-CQS325-Setting-New-Standards-for-Smart-Connected-Solutions-with-Edge-Computing.html,Positive,0.5267
Is Super Micro Computer Inc. (SMCI) the Best Affordable Tech Stock to Buy According to Analysts?,2025-03-28T17:30:34Z,https://finance.yahoo.com/news/super-micro-computer-inc-smci-173034989.html,Positive,0.8442
"United States Electric Assisted Bicycles (Non-Rental) Market is Poised to Reach US$ 5,121.50 Million by 2033 | Astute Analytica",2025-03-28T17:30:00Z,https://www.globenewswire.com/news-release/2025/03/28/3051564/0/en/United-States-Electric-Assisted-Bicycles-Non-Rental-Market-is-Poised-to-Reach-US-5-121-50-Million-by-2033-Astute-Analytica.html,Positive,0.5994
How Retailers Can Use Technology To Cut Costs (Not Corners),2025-03-28T17:15:53Z,https://www.forbes.com/councils/forbestechcouncil/2025/03/28/how-retailers-can-use-technology-to-cut-costs-not-corners/,Negative,-0.2732
Edge AI semiconductor maker MemryX raises $44M,2025-03-28T17:05:44Z,https://siliconangle.com/2025/03/28/edge-ai-semiconductor-maker-memryx-raises-44m/,Neutral,0.0
"Smart HVAC Systems to Revolutionise Building Efficiency, Cybersecurity, and Customer Experience",2025-03-28T16:54:00Z,https://www.prnewswire.co.uk/news-releases/smart-hvac-systems-to-revolutionise-building-efficiency-cybersecurity-and-customer-experience-302414447.html,Positive,0.6369
"United States Cold Heading Wire Market Set to Attain Valuation of US$ 2,533.74 Million By 2033 | Astute Analytica",2025-03-28T16:30:00Z,https://www.globenewswire.com/news-release/2025/03/28/3051517/0/en/United-States-Cold-Heading-Wire-Market-Set-to-Attain-Valuation-of-US-2-533-74-Million-By-2033-Astute-Analytica.html,Positive,0.4215
aws-solutions-constructs.aws-iot-lambda-dynamodb 2.81.0,2025-03-28T16:11:02Z,https://pypi.org/project/aws-solutions-constructs-aws-iot-lambda-dynamodb/2.81.0/,Neutral,0.0
"Continuous Thermal Monitoring Industry Forecasts 2024-2030 with ABB, Siemens, Schneider Electric, Honeywell International and Teledyne Technologies Dominating",2025-03-28T16:09:00Z,https://www.globenewswire.com/news-release/2025/03/28/3051504/28124/en/Continuous-Thermal-Monitoring-Industry-Forecasts-2024-2030-with-ABB-Siemens-Schneider-Electric-Honeywell-International-and-Teledyne-Technologies-Dominating.html,Negative,-0.296
Worldwide spending on genAI to surge by hundreds of billions of dollars,2025-03-28T15:28:12Z,https://www.computerworld.com/article/3856401/worldwide-spending-on-genai-to-surge-by-hundreds-of-billions-of-dollars.html,Neutral,0.0
Location-Based Services (LBS) Global Strategic Business Report 2024-2030: Market Expansion Fueled by Technological Advancements and Increased Consumer Expectations,2025-03-28T15:20:00Z,https://www.globenewswire.com/news-release/2025/03/28/3051480/28124/en/Location-Based-Services-LBS-Global-Strategic-Business-Report-2024-2030-Market-Expansion-Fueled-by-Technological-Advancements-and-Increased-Consumer-Expectations.html,Positive,0.2732
Nine in Ten Healthcare Organizations Use the Most Vulnerable IoT Devices,2025-03-28T14:50:00Z,https://www.infosecurity-magazine.com/news/healthcare-vulnerable-iot-devices/,Negative,-0.2944
United States (USA) ACaaS Market worth $1.64 billion by 2029 - Exclusive Report by MarketsandMarkets™,2025-03-28T14:45:00Z,https://www.prnewswire.co.uk/news-releases/united-states-usa-acaas-market-worth-1-64-billion-by-2029---exclusive-report-by-marketsandmarkets-302414056.html,Positive,0.6369
"AI Gateway Market to Reach $9843 Million by 2031, Driven by Cloud and On-Premise Deployments | Valuates Reports",2025-03-28T14:30:00Z,https://www.prnewswire.co.uk/news-releases/ai-gateway-market-to-reach-9843-million-by-2031-driven-by-cloud-and-on-premise-deployments--valuates-reports-302414357.html,Positive,0.0258
Cavli CQS315 & CQS325: Enhancing Smart Connectivity with the Power of Edge Computing,2025-03-28T14:13:00Z,https://www.globenewswire.com/news-release/2025/03/28/3051449/0/en/Cavli-CQS315-CQS325-Enhancing-Smart-Connectivity-with-the-Power-of-Edge-Computing.html,Positive,0.4019
SEALSQ and IC’ALPS Join Forces to Advance Post-Quantum Secure ASICs for Automotive Functional Safety,2025-03-28T14:10:00Z,https://www.globenewswire.com/news-release/2025/03/28/3051447/0/en/SEALSQ-and-IC-ALPS-Join-Forces-to-Advance-Post-Quantum-Secure-ASICs-for-Automotive-Functional-Safety.html,Positive,0.7506
Data Center Liquid Cooling Market worth $21.14 billion by 2032 - Exclusive Report by MarketsandMarkets™,2025-03-28T14:01:00Z,https://www.prnewswire.co.uk/news-releases/data-center-liquid-cooling-market-worth-21-14-billion-by-2032--exclusive-report-by-marketsandmarkets-302414205.html,Positive,0.34
5G NTN Market to Reach USD 77.9 Billion by 2032| SNS Insider,2025-03-28T14:00:00Z,https://www.globenewswire.com/news-release/2025/03/28/3051436/0/en/5G-NTN-Market-to-Reach-USD-77-9-Billion-by-2032-SNS-Insider.html,Positive,0.0258
"AI Update, March 28, 2025: AI News and Views From the Past Week",2025-03-28T14:00:00Z,https://www.marketingprofs.com/opinions/2025/52941/ai-update-march-28-2025-ai-news-and-views-from-the-past-week,Neutral,0.0
"Computerized Maintenance Management System Market to Hit USD 3.72 Billion by 2032, at a CAGR of 10.81% | SNS Insider",2025-03-28T13:30:00Z,https://www.globenewswire.com/news-release/2025/03/28/3051413/0/en/Computerized-Maintenance-Management-System-Market-to-Hit-USD-3-72-Billion-by-2032-at-a-CAGR-of-10-81-SNS-Insider.html,Neutral,0.0
"Device as a Service Market to Reach USD 1688.53 Billion by 2032, Driven by the Growing Demand for Cost-Effective and Scalable IT Solutions | SNS Insider",2025-03-28T13:15:00Z,https://www.globenewswire.com/news-release/2025/03/28/3051406/0/en/Device-as-a-Service-Market-to-Reach-USD-1688-53-Billion-by-2032-Driven-by-the-Growing-Demand-for-Cost-Effective-and-Scalable-IT-Solutions-SNS-Insider.html,Positive,0.25
Cross-Platform P2P Wi-Fi: How the EU Killed AWDL,2025-03-28T13:13:04Z,https://www.ditto.com/blog/cross-platform-p2p-wi-fi-how-the-eu-killed-awdl,Negative,-0.6705
Proptech Advancements Helping Accelerate Co-Working’s Gains,2025-03-28T13:00:00Z,https://www.forbes.com/sites/jeffsteele/2025/03/28/proptech-advancements-helping-accelerate-co-workings-gains/,Positive,0.5574
"Medical Sensors Market to Hit USD 209.70 billion by 2032, Driven by Growing Demand for Remote Monitoring and Wearable Tech | SNS Insider",2025-03-28T13:00:00Z,https://www.globenewswire.com/news-release/2025/03/28/3051397/0/en/Medical-Sensors-Market-to-Hit-USD-209-70-billion-by-2032-Driven-by-Growing-Demand-for-Remote-Monitoring-and-Wearable-Tech-SNS-Insider.html,Positive,0.0516
"VPN services may soon become a new target of EU lawmakers after being deemed a ""key challenge""",2025-03-28T12:33:08Z,https://www.techradar.com/vpn/vpn-privacy-security/vpn-services-may-soon-become-a-new-target-of-eu-lawmakers-after-being-deemed-a-key-challenge,Positive,0.0772
"Actelis Receives Significant New Orders to Modernize U.S. Military Bases with Rapid Deployment, Cyber Hardened Networking",2025-03-28T12:00:00Z,https://www.globenewswire.com/news-release/2025/03/28/3051330/0/en/Actelis-Receives-Significant-New-Orders-to-Modernize-U-S-Military-Bases-with-Rapid-Deployment-Cyber-Hardened-Networking.html,Positive,0.2023
Cavli Wireless to Feature the CQS315 and CQS325 Smart IoT Modules at CAEV Expo 2025,2025-03-28T11:51:32Z,https://financialpost.com/globe-newswire/cavli-wireless-to-feature-the-cqs315-and-cqs325-smart-iot-modules-at-caev-expo-2025,Positive,0.4019
Cavli Wireless to Feature the CQS315 and CQS325 Smart IoT Modules at CAEV Expo 2025,2025-03-28T11:49:00Z,https://www.globenewswire.com/news-release/2025/03/28/3051311/0/en/Cavli-Wireless-to-Feature-the-CQS315-and-CQS325-Smart-IoT-Modules-at-CAEV-Expo-2025.html,Positive,0.4019
Short-Term Rental Trends: Sustainability And Smart Tech,2025-03-28T11:45:00Z,https://www.forbes.com/councils/forbesbusinesscouncil/2025/03/28/short-term-rental-trends-sustainability-and-smart-tech/,Positive,0.4019
"Intelligent Evacuation Systems Global Strategic Business Report 2024-2025 & 2030: Focus on Real-Time Emergency Response, Focus on Occupant Tracking and Analytics Fuels Innovations",2025-03-28T11:45:00Z,https://www.globenewswire.com/news-release/2025/03/28/3051308/28124/en/Intelligent-Evacuation-Systems-Global-Strategic-Business-Report-2024-2025-2030-Focus-on-Real-Time-Emergency-Response-Focus-on-Occupant-Tracking-and-Analytics-Fuels-Innovations.html,Positive,0.1027
"Turkey Telecom (Fixed Telephony, Broadband, Mobile, Pay-TV) Operators Intelligence Report 2025, Competitive Analysis of Turkcell, Turk Telekom, Vodafone, Turksat, Digiturk, Dsmart - Forecast to 2029",2025-03-28T10:46:00Z,https://www.globenewswire.com/news-release/2025/03/28/3051252/28124/en/Turkey-Telecom-Fixed-Telephony-Broadband-Mobile-Pay-TV-Operators-Intelligence-Report-2025-Competitive-Analysis-of-Turkcell-Turk-Telekom-Vodafone-Turksat-Digiturk-Dsmart-Forecast-to.html,Positive,0.5859
Navigating Linux security and management in a multi-OS landscape [Q&A],2025-03-28T10:39:03Z,https://betanews.com/2025/03/28/navigating-linux-security-and-management-in-a-multi-os-landscape-qa/,Positive,0.34
"Romania Telecom Operators Intelligence Report 2025, Competitive Analysis of Orange, Vodafone, Telekom Romania, and RCS & RDS",2025-03-28T10:37:00Z,https://www.globenewswire.com/news-release/2025/03/28/3051250/28124/en/Romania-Telecom-Operators-Intelligence-Report-2025-Competitive-Analysis-of-Orange-Vodafone-Telekom-Romania-and-RCS-RDS.html,Positive,0.5859
Mozilla fixed critical Firefox vulnerability CVE-2025-2857,2025-03-28T09:51:49Z,https://securityaffairs.com/175945/security/mozilla-fixed-critical-firefox-vulnerability-cve-2025-2857.html,Negative,-0.4939
"Printers Industry Research 2025-2033: CAGR of 4.54% Projected Despite Declining Demand for Traditional Printers, Price Pressures and Competition",2025-03-28T09:21:00Z,https://www.globenewswire.com/news-release/2025/03/28/3051214/28124/en/Printers-Industry-Research-2025-2033-CAGR-of-4-54-Projected-Despite-Declining-Demand-for-Traditional-Printers-Price-Pressures-and-Competition.html,Negative,-0.2335
"Netherlands Robotics (Industrial & Service) Market Report 2025-2033: Growing Uptake in Manufacturing, Healthcare, and Logistics Driving Revenues to Reach $2.54 Billion by 2033",2025-03-28T09:16:00Z,https://www.globenewswire.com/news-release/2025/03/28/3051209/28124/en/Netherlands-Robotics-Industrial-Service-Market-Report-2025-2033-Growing-Uptake-in-Manufacturing-Healthcare-and-Logistics-Driving-Revenues-to-Reach-2-54-Billion-by-2033.html,Positive,0.2023
Atmospheric Water Generator Market Report 2025: IoT-Enabled and 4th-Gen AWGs Drive Market Growth,2025-03-28T09:12:00Z,https://www.globenewswire.com/news-release/2025/03/28/3051205/28124/en/Atmospheric-Water-Generator-Market-Report-2025-IoT-Enabled-and-4th-Gen-AWGs-Drive-Market-Growth.html,Positive,0.3818
Intelligent RAN Automation Solutions Market Report 2025-2033: Network Slicing and Private 5G Create Lucrative Opportunities for Intelligent RAN Solutions,2025-03-28T09:10:00Z,https://www.globenewswire.com/news-release/2025/03/28/3051203/28124/en/Intelligent-RAN-Automation-Solutions-Market-Report-2025-2033-Network-Slicing-and-Private-5G-Create-Lucrative-Opportunities-for-Intelligent-RAN-Solutions.html,Positive,0.9022
"Lithium-Ion UPS Market for Data Centers 2025-2035: Analysis of Products, Applications, Companies, and Markets at the Country-Level",2025-03-28T09:05:00Z,https://www.globenewswire.com/news-release/2025/03/28/3051198/28124/en/Lithium-Ion-UPS-Market-for-Data-Centers-2025-2035-Analysis-of-Products-Applications-Companies-and-Markets-at-the-Country-Level.html,Neutral,0.0
"Supply Chain Security Markets, 2030 - Rapid Growth in the e-Commerce, Advancing Risk Prediction and Management, Increasing IoT Devices Deployments",2025-03-28T09:03:00Z,https://www.globenewswire.com/news-release/2025/03/28/3051195/28124/en/Supply-Chain-Security-Markets-2030-Rapid-Growth-in-the-e-Commerce-Advancing-Risk-Prediction-and-Management-Increasing-IoT-Devices-Deployments.html,Positive,0.4404
"Natixis Advisors LLC Sells 1,286 Shares of Iridium Communications Inc. (NASDAQ:IRDM)",2025-03-28T08:38:50Z,https://www.etfdailynews.com/2025/03/28/natixis-advisors-llc-sells-1286-shares-of-iridium-communications-inc-nasdaqirdm/,Positive,0.296
"Alarm.com Holdings, Inc. (NASDAQ:ALRM) Stock Holdings Lessened by Thrivent Financial for Lutherans",2025-03-28T08:28:46Z,https://www.etfdailynews.com/2025/03/28/alarm-com-holdings-inc-nasdaqalrm-stock-holdings-lessened-by-thrivent-financial-for-lutherans/,Neutral,0.0
"Contribute to Fedora 42 KDE, Virtualization, and Upgrade Test Days",2025-03-28T08:00:00Z,https://fedoramagazine.org/contribute-to-fedora-42-kde-virtualization-and-upgrade-test-days/,Neutral,0.0
Tern (LON:TERN) Share Price Passes Below 200 Day Moving Average – What’s Next?,2025-03-28T07:58:57Z,https://www.etfdailynews.com/2025/03/28/tern-lontern-share-price-passes-below-200-day-moving-average-whats-next/,Positive,0.296
HighTower Advisors LLC Lowers Stake in Iridium Communications Inc. (NASDAQ:IRDM),2025-03-28T07:46:45Z,https://www.etfdailynews.com/2025/03/28/hightower-advisors-llc-lowers-stake-in-iridium-communications-inc-nasdaqirdm/,Negative,-0.128
CyanConnode (LON:CYAN) Stock Price Passes Above 200-Day Moving Average – Should You Sell?,2025-03-28T07:08:47Z,https://www.etfdailynews.com/2025/03/28/cyanconnode-loncyan-stock-price-passes-above-200-day-moving-average-should-you-sell/,Neutral,0.0
The great crypto power struggle: How technocrats and governments are reshaping global finance,2025-03-28T06:00:00Z,https://www.naturalnews.com/2025-03-28-crypto-power-struggle-technocrats-governments-reshaping-global-finance.html,Positive,0.4215
The US Needs A New Cybersecurity Strategy: More Offensive Cyber Operations Isn't It,2025-03-28T05:23:00Z,https://malwaretech.com/2025/03/the-us-needs-a-new-cybersecurity-strategy.html,Negative,-0.5095
SwitchBot’s Amazon Spring Sale Lets You Automate Your Entire House And Save Over $1000,2025-03-28T02:15:54Z,https://www.yankodesign.com/2025/03/27/switchbots-amazon-spring-sale-lets-you-automate-your-entire-house-and-save-over-1000/,Positive,0.5994
【ＤＴＳ】東北システムズ・サポート、神田にショールーム「RFID / IoT TOKYO LAB #2」をオープン,2025-03-28T01:00:00Z,https://prtimes.jp/main/html/rd/p/000000167.000081622.html,Neutral,0.0
高度プロフェッショナル人材としてトヨタグループをはじめとするデジタル、DX業界へ　名古屋国際工科専門職大学の第1期生が卒業,2025-03-28T01:00:00Z,https://prtimes.jp/main/html/rd/p/000000761.000011137.html,Neutral,0.0
U.S. CISA adds Google Chromium Mojo flaw to its Known Exploited Vulnerabilities catalog,2025-03-27T23:02:32Z,https://securityaffairs.com/175936/security/u-s-cisa-adds-google-chromium-mojo-flaw-to-its-known-exploited-vulnerabilities-catalog.html,Negative,-0.5574
tencentcloud-sdk-python-iot 3.0.1350,2025-03-27T21:01:03Z,https://pypi.org/project/tencentcloud-sdk-python-iot/3.0.1350/,Neutral,0.0
BCC Research Reveals Key Semiconductor Market Trends in 2024 Review,2025-03-27T20:15:00Z,https://www.globenewswire.com/news-release/2025/03/27/3051032/0/en/BCC-Research-Reveals-Key-Semiconductor-Market-Trends-in-2024-Review.html,Neutral,0.0
Human-collaborative robot operates in cybernics space for daily support,2025-03-27T19:13:03Z,https://techxplore.com/news/2025-03-human-collaborative-robot-cybernics-space.html,Positive,0.4019
Honeywell and Verizon Partner for Smart Meter Connectivity,2025-03-27T17:59:21Z,https://www.telecompetitor.com/honeywell-and-verizon-partner-for-smart-meter-connectivity/,Positive,0.4019
ISC West Strives To Redefine The Future Of Converged Security,2025-03-27T17:49:26Z,https://www.forbes.com/sites/tonybradley/2025/03/27/isc-west-strives-to-redefine-the-future-of-converged-security/,Positive,0.34
The Digital Treadmill: BCIT Founder Elucidates on Why Businesses Must Adapt Now in the Age of Industry 5.0,2025-03-27T17:21:43Z,https://www.ibtimes.com/digital-treadmill-bcit-founder-elucidates-why-businesses-must-adapt-now-age-industry-50-3767908,Neutral,0.0
LILYGO T-Deck Pro Offers E-Paper Display with Configurable 4G and Voice Options,2025-03-27T17:16:04Z,https://linuxgizmos.com/?p=93541,Neutral,0.0
Announcing 3 new features on Connected Mobility Solution on AWS,2025-03-27T17:00:00Z,https://aws.amazon.com/about-aws/whats-new/2025/03/3-new-features-connected-mobility-solution/,Positive,0.3182
aws-solutions-constructs.aws-iot-sqs 2.80.0,2025-03-27T16:47:32Z,https://pypi.org/project/aws-solutions-constructs-aws-iot-sqs/2.80.0/,Neutral,0.0
aws-solutions-constructs.aws-iot-s3 2.80.0,2025-03-27T16:47:31Z,https://pypi.org/project/aws-solutions-constructs-aws-iot-s3/2.80.0/,Neutral,0.0
aws-solutions-constructs.aws-iot-lambda-dynamodb 2.80.0,2025-03-27T16:47:29Z,https://pypi.org/project/aws-solutions-constructs-aws-iot-lambda-dynamodb/2.80.0/,Neutral,0.0
aws-solutions-constructs.aws-iot-lambda 2.80.0,2025-03-27T16:47:28Z,https://pypi.org/project/aws-solutions-constructs-aws-iot-lambda/2.80.0/,Neutral,0.0
aws-solutions-constructs.aws-iot-kinesisstreams 2.80.0,2025-03-27T16:47:27Z,https://pypi.org/project/aws-solutions-constructs-aws-iot-kinesisstreams/2.80.0/,Neutral,0.0
aws-solutions-constructs.aws-iot-kinesisfirehose-s3 2.80.0,2025-03-27T16:47:25Z,https://pypi.org/project/aws-solutions-constructs-aws-iot-kinesisfirehose-s3/2.80.0/,Neutral,0.0
Running wpe-webkit-mir-kiosk into Ubuntu Core under Proxmox VE,2025-03-27T16:45:30Z,https://askubuntu.com/questions/1544616/running-wpe-webkit-mir-kiosk-into-ubuntu-core-under-proxmox-ve,Neutral,0.0
"Backup Power Generator Monitoring and Control Provider Acorn to Present at Planet MicroCap Showcase in Las Vegas Wednesday, April 23rd at 11am PT",2025-03-27T16:30:00Z,https://www.globenewswire.com/news-release/2025/03/27/3050818/0/en/Backup-Power-Generator-Monitoring-and-Control-Provider-Acorn-to-Present-at-Planet-MicroCap-Showcase-in-Las-Vegas-Wednesday-April-23rd-at-11am-PT.html,Neutral,0.0
"Medical Equipment Rental Market Projected to Reach USD 97.69 Billion by 2032, Driven by Cost Efficiency and Growing Healthcare Demand – SNS Insider",2025-03-27T16:06:00Z,https://www.globenewswire.com/news-release/2025/03/27/3050797/0/en/Medical-Equipment-Rental-Market-Projected-to-Reach-USD-97-69-Billion-by-2032-Driven-by-Cost-Efficiency-and-Growing-Healthcare-Demand-SNS-Insider.html,Positive,0.4215
